Title	Snippet	URL	Category
Lincoln Díaz-Balart, a ‘Free Cuba’ Republican in Congress, Dies at 70	The Florida scion of an anti-communist political family, he served in the House for 18 years at a time when Cuban Americans exerted peak influence on U.S. policies.	https://www.nytimes.com/2025/03/04/us/politics/lincoln-diaz-balart-dead.html	Politics
What to Expect From Trump’s Address to Congress	Also, Canada and China retaliated against U.S. tariffs. Here’s the latest at the end of Tuesday.	https://www.nytimes.com/2025/03/04/briefing/trump-speech-congress-tariff-canada-china-mexico.html	Politics
Democrats Call for Inquiry Into Top Justice Official Over Adams Case	Senate Democrats asked a New York legal disciplinary panel to consider whether Emil Bove III abused his power in seeking the dismissal of the federal corruption case against Mayor Eric Adams.	https://www.nytimes.com/2025/03/04/nyregion/senate-democrats-emil-bove-complaint.html	Politics
Read the Senators’ Letter About Emil Bove	The Democratic members of the Senate Judiciary Committee asked a New York State legal committee to investigate Emil Bove III, a Justice Department official who is seeking to end the prosecution of Mayor Eric Adams of New York City.	https://www.nytimes.com/interactive/2025/03/04/us/2025-03-04-sjc-bar-complaint-re-bove.html	Politics
7 Tesla Charging Stations Torched Near Boston	The fires, which the police said were intentionally set, are the latest in a series of attacks against Elon Musk’s company.	https://www.nytimes.com/2025/03/04/us/politics/tesla-charging-stations-arson-boston.html	Politics
American Farmers Brace for Harm From Retaliatory Tariffs	Trade wars during President Trump’s first term slashed billions of dollars in U.S. agricultural exports. Farmers and trade groups expect an even bigger hit this time.	https://www.nytimes.com/2025/03/04/business/retaliatory-tariffs-farmers.html	Politics
Climate Groups Were Counting on $20 Billion. Trump Won’t Let Them Access It.	The Justice Department and F.B.I. are investigating $20 billion in climate funds, despite a top prosecutor’s decision that there was not sufficient evidence of wrongdoing.	https://www.nytimes.com/2025/03/04/climate/green-bank-climate-trump-freeze.html	Politics
How Music Took Over This Year’s Oscars	On Popcast, a conversation about the smooth and bumpy ways that the Academy Awards incorporated music into its 97th annual ceremony on Sunday.	https://www.nytimes.com/2025/03/04/arts/music/oscars-music-wicked-popcast.html	Politics
Canada and China Retaliate Against U.S. Tariffs, Which Trudeau Derides as ‘Dumb’	Prime Minister Justin Trudeau of Canada warned that the Trump administration’s tariffs were leading to a trade war. Mexico’s leader vowed to impose countermeasures on Sunday.	https://www.nytimes.com/2025/03/04/world/americas/tariffs-mexico-canada-china-trump.html	Politics
The (Fatuous) Case for Betraying Ukraine	The organizing principle of Putin’s reign has been the restoration of Soviet power at the expense of people power.	https://www.nytimes.com/2025/03/04/opinion/trump-zelensky-ukraine.html	Politics
Germans Agree to Borrow More for Military, in Sharp Response to Trump	The agreement between Friedrich Merz, the likely next chancellor, and his potential coalition partners also includes big new infrastructure spending.	https://www.nytimes.com/2025/03/04/world/europe/germany-military-merz-trump.html	Politics
Veterans Are Caught Up in Trump’s and Musk’s Work Force Overhaul	Nearly 30 percent of civil service employees in the federal government are veterans. Democrats are highlighting their firings by taking some as guests to President Trump’s address on Tuesday.	https://www.nytimes.com/2025/03/04/us/politics/veteran-firings-trump-musk-democrats.html	Politics
Peter Sichel, Wine Merchant With a Cloak-and-Dagger Past, Dies at 102	He played a crucial role in the early days of the C.I.A., as a station chief in Cold War Berlin and Hong Kong, before shifting gears to popularize Blue Nun wine.	https://www.nytimes.com/2025/03/04/dining/drinks/peter-sichel-dead.html	Politics
Trudeau, on His Way Out of Office, Sharply Rebukes Trump Over Tariffs	The Canadian prime minister was visibly angry not only over the president’s tariffs, but also over his repeated suggestions that he would make Canada ‘the 51st state’ and his growing closeness to Russia.	https://www.nytimes.com/2025/03/04/us/trudeau-canada-tariffs-trump.html	Politics
Senator Slotkin Will Deliver Democrats’ Response to Trump’s Speech	The Michigan Democrat, a first-term senator, is expected to lay out the economic and national security stakes of President Trump’s agenda.	https://www.nytimes.com/2025/03/04/us/politics/elissa-slotkin-democrats-response-trump-speech.html	Politics
Not Time’s Fool: A Rare Version of a Shakespeare Sonnet Is Discovered	An Oxford researcher found a rare, handwritten variation of one of Shakespeare’s most famous love poems. About 400 years ago, its meaning might have been very different.	https://www.nytimes.com/2025/03/04/world/europe/shakespeare-sonnet-oxford-discovery.html	Politics
Conservatives Hobble Iran’s Moderate President, Stoking a Political Crisis	With Iran already wounded economically and diplomatically, hard-liners forced out two top officials and blocked talks with the United States, freezing President Masoud Pezeshkian’s agenda.	https://www.nytimes.com/2025/03/04/world/middleeast/iran-conservatives-zarif-pezeshkian.html	Politics
Argentines in Rome Pray for a Pope Who’s One of Their Own	The expatriate community is small but shares a special bond with Francis, who has been in the hospital since Feb. 14.	https://www.nytimes.com/2025/03/04/world/europe/pope-francis-argentines-rome.html	Politics
Trump’s Sharp Shift on Ukraine and Russia	Readers react to news about Russia and Ukraine. Also: A “horrified” expat and a “saddened” Canadian; the new tariffs; research cuts.	https://www.nytimes.com/2025/03/04/opinion/trump-ukraine-russia.html	Politics
Judge Says Trump Can’t Fire Chair of Federal Workers Board Without Cause	Cathy Harris had sued to block her dismissal from the panel that handles government employee disputes. Employees swept up in the Trump administration’s mass firings have appealed to the board.	https://www.nytimes.com/2025/03/04/us/politics/trump-cathy-harris-firing-cause.html	Politics
N.Y.C. Council Speaker Attacks Trump in Potential Preview of Mayoral Bid	In her final State of the City address, Speaker Adrienne Adams, who is considering a run for mayor, proposed ideas that she said could be “scaled for greater impact.”	https://www.nytimes.com/2025/03/04/nyregion/adrienne-adams-mayor-state-of-city.html	Politics
The Wi-Fi Code Is ‘TrumpLovesYou,’ but the Cafe’s Clients Aren’t Feeling It	At a pizza and coffee joint in Kyiv named for the U.S. president, patrons are having second thoughts about its moniker after President Trump suspended military aid to Ukraine.	https://www.nytimes.com/2025/03/04/world/europe/trump-ukraine-pizza-cafe.html	Politics
After Trump Applies Pressure, Wall Street Giant Moves Into Panama	An investor group led by BlackRock will acquire two ports near the Panama Canal that are owned by CK Hutchison and have been the subject of a dispute between President Trump and Panama.	https://www.nytimes.com/2025/03/04/business/blackrock-panama-canal-ports-hutchison.html	Politics
After a Decade Away, ‘Mamma Mia!’ Is Returning to Broadway This Summer	The musical’s original run was the ninth-longest in Broadway history; a six-month return engagement will start in August.	https://www.nytimes.com/2025/03/04/theater/mamma-mia-broadway-abba.html	Politics
Trump’s Tariffs Plunge Global Markets Into a Sea of Red	Global leaders are retaliating and investors have sold off stocks in Asia and Europe.	https://www.nytimes.com/2025/03/04/business/dealbook/trump-tariffs-markets-business.html	Politics
Stories by Harper Lee to Appear for the First Time in a New Collection	Before she published “To Kill a Mockingbird,” Lee had written short stories in which she explored some of its themes and characters.	https://www.nytimes.com/2025/03/04/books/harper-lee-land-of-sweet-forever.html	Politics
Zelensky Offers Terms to Stop Fighting, Assuring U.S. That Ukraine Wants Peace	“We are working on all possible scenarios to protect Ukraine,” said President Volodymyr Zelensky, whose country was looking to European allies for support.	https://www.nytimes.com/2025/03/04/world/europe/ukraine-us-trump-military-support.html	Politics
America’s Flex	We cover President Trump’s new tariffs.	https://www.nytimes.com/2025/03/04/briefing/donald-trump-tariffs-canada-mexico-china.html	Politics
DOGE Has a Math Problem	Why the claims of Elon Musk’s government-cutting team are not what they seem.	https://www.nytimes.com/2025/03/04/podcasts/the-daily/doge-elon-musk.html	Politics
In One Swing District, Guarded Optimism After Trump’s First Six Weeks	With President Trump set to address a joint session of Congress on Tuesday, many voters in Arizona’s divided First Congressional District remain hopeful for his new term, even amid partisan rancor.	https://www.nytimes.com/2025/03/04/us/politics/trump-arizona-swing-voters.html	Politics
How Americans Feel About Tariffs	Trump loves tariffs. Do Americans? It depends how pollsters ask the question.	https://www.nytimes.com/interactive/2025/03/04/polls/tariffs-trump-poll.html	Politics
Commerce Secretary’s Comments Raise Fears of Interference in Federal Data	Howard Lutnick, the commerce secretary, suggested government spending should be excluded from data about U.S. economic output.	https://www.nytimes.com/2025/03/04/business/economy/gdp-data-lutnick-commerce-secretary.html	Politics
‘Trump Is the Real Thing’	Vengeance is his.	https://www.nytimes.com/2025/03/04/opinion/trump-imperial-presidency.html	Politics
The Government Knows A.G.I. Is Coming	The Biden administration’s A.I. adviser Ben Buchanan discusses how the U.S. government is preparing for artificial general intelligence — and all the challenges that remain.	https://www.nytimes.com/2025/03/04/opinion/ezra-klein-podcast-ben-buchanan.html	Politics
Fact-Checking Trump’s Claims on Tariffs, Ukraine and DOGE	The president has repeatedly made false or misleading claims in pursuing an aggressive agenda in the first weeks of his second term.	https://www.nytimes.com/2025/03/04/us/politics/fact-check-trump-immigration-economy-doge-fraud.html	Politics
Arab States Propose Alternative to Trump’s Gaza Plan	Trying to counter President Trump’s call to “clean out” Gaza, Arab leaders have begun to outline their own vision for Palestinians in the territory.	https://www.nytimes.com/2025/03/04/world/middleeast/gaza-arab-leaders-meeting.html	Politics
There Is No Musk Exception in the Constitution	Trump is on shaky ground when it comes to the way he has empowered perhaps the most important figure in the new administration.	https://www.nytimes.com/2025/03/04/opinion/elon-musk-trump-constitution.html	Politics
In Face of Trump’s Tariffs, Mexico Embraces Its President and Nationalism	Before the tariffs went into effect, approval ratings for President Claudia Sheinbaum rose and companies began marketing “Made in Mexico” products.	https://www.nytimes.com/2025/03/04/world/americas/mexico-tariffs-nationalism.html	Politics
Memo to the Business Elite: It’s Time to Stand Up	Most executives are not protectionist, isolationist or xenophobic. Nor do they want to be complicit.	https://www.nytimes.com/2025/03/04/opinion/business-ceo-trump-tariffs.html	Politics
How Trump Can Turn the Ukraine Mineral Deal Into Real Security	Trump needs to back up any minerals agreement with substantive investment and diplomacy.	https://www.nytimes.com/2025/03/04/opinion/ukraine-minerals-deal.html	Politics
How Covid Remade America	It feels as if the pandemic is behind us. But we’re living in the world it made.	https://www.nytimes.com/interactive/2025/03/04/opinion/covid-impact-five-years-later.html	Politics
The ‘Parasite’ Director Brings Class Warfare To Outer Space	Bong Joon Ho has turned his funny-sad excavations of life under capitalism into unlikely blockbusters. With “Mickey 17,” he’s bending a whole new genre.	https://www.nytimes.com/2025/03/04/magazine/bong-joon-ho-mickey-17.html	Politics
A Russia-Friendly Region Cheers Trump’s Reordering of the U.S. Role in the World	Many ethnic Serbs in what was once Yugoslavia have long chafed at Washington’s foreign policy. ‘Trump’s America is different,’ said a former leader of a Serb enclave in Bosnia.	https://www.nytimes.com/2025/03/04/world/europe/russia-trump-bosnia.html	Politics
Why Putin Can’t Wait to Have McDonald’s Back in Moscow	As the Trump administration pushes for renewed business ties with Russia, a new book looks back at the companies that helped prop up illiberalism in the country.	https://www.nytimes.com/2025/03/04/books/review/zero-sum-charles-hecker.html	Politics
To Oppose Trump, Democrats Should Remember How They Opposed George W. Bush	What the left chooses to fight on now will shape future elections.	https://www.nytimes.com/2025/03/04/opinion/democrats-harry-reid-nancy-pelosi.html	Politics
After the Apocalypse, Will We Decamp to a Suburb or a High-Rise?	“Paradise” and “Silo” have opposing takes on the future of urban organization, echoing the debate over America’s housing shortage today.	https://www.nytimes.com/2025/03/04/business/economy/silo-paradise-housing-shortage.html	Politics
The Shop That Changed What We Wear	Agnès b. was fresh, cool and totally Parisian, and it established the model for a raft of accessibly chic Euro labels to come.	https://www.nytimes.com/2025/03/04/style/agnes-b-agnes-trouble-shopping-paris.html	Politics
What to Know About Proposals to Fix the Chaos at Rikers Island	As a judge considers appointing a receiver to oversee the jails, there are two very different plans for how that would work.	https://www.nytimes.com/2025/03/04/nyregion/rikers-island-receiver-explainer.html	Politics
China Retaliates Against Trump Tariffs as Superpower Trade War Escalates	Beijing imposed broad tariffs on imports of American food and said 15 U.S. companies could no longer buy from China without special permission.	https://www.nytimes.com/2025/03/04/business/trump-tariffs-china-reacts.html	Politics
Germany Needs to Get Its Act Together. Under Him, It Won’t.	Friedrich Merz, almost certain to be the country’s next chancellor, is yesterday’s man.	https://www.nytimes.com/2025/03/04/opinion/friedrich-merz-germany-chancellor.html	Politics
Justice Dept. to Review Election Tampering Conviction of Pro-Trump Clerk	The decision, revealed in a filing in a Colorado clerk’s bid to overturn her conviction, marks another example of President Trump’s Justice Department intervening to aid supporters or go after foes.	https://www.nytimes.com/2025/03/03/us/politics/tina-peters-clerk-election-trump.html	Politics
U.S. Attorney Rebuffed by Justice Dept. in Push to Escalate Inquiry Into Schumer	Ed Martin, the acting U.S. attorney in Washington, has been blocked so far in seeking a grand jury investigation into remarks made by Senator Chuck Schumer about Supreme Court justices.	https://www.nytimes.com/2025/03/03/us/politics/us-attorney-justice-dept-schumer-inquiry.html	Politics
2 Democrats Begin Investigation of Move to Drop Adams Charges	In a letter to Attorney General Pam Bondi, the lawmakers, Jamie Raskin of Maryland and Jasmine Crockett of Texas, accused the Justice Department of a coverup.	https://www.nytimes.com/2025/03/03/nyregion/eric-adams-democrats-investigation.html	Politics
Democrats Block Bill to Bar Transgender Girls From Female Sports Teams	Republicans argued the bill was essential to protecting women and girls, but also made clear they were bringing it up to portray Democrats as outside the mainstream. It stalled in the Senate.	https://www.nytimes.com/2025/03/03/us/politics/democrats-transgender-girls-sports.html	Politics
Lech Walesa, Polish Labor Leader Who Fought U.S.S.R.’s Power, Joins in Horrified Letter to Trump	He and former Polish political prisoners voiced “horror and disgust” at President Trump’s scolding of President Volodymyr Zelensky of Ukraine last week, saying it reminded them of encounters with bullying Communist-era officials.	https://www.nytimes.com/2025/03/03/us/politics/lech-walesa-trump-letter.html	Politics
Senate Confirms Linda McMahon as Education Secretary	Ms. McMahon, who has little experience in private or public schools, will take over a department that President Trump has already begun to dismantle.	https://www.nytimes.com/2025/03/03/us/politics/linda-mcmahon-education-secretary.html	Politics
Tesla for Sale: Buyer’s Remorse Sinks In for Elon Musk’s E.V.-Owning Critics	The backlash against the electric vehicle company has intensified as the billionaire ally of President Trump exerts his power over the federal government.	https://www.nytimes.com/2025/03/03/business/tesla-boycott-elon-musk.html	Politics
Seeing Political Red Meat, Texas May Rename the New York Strip Steak	The Texas strip? That state’s lieutenant governor wants to rebrand the cut, but New Yorkers aren’t biting.	https://www.nytimes.com/2025/03/03/dining/texas-new-york-strip.html	Politics
Trump Said Tariffs Are Coming	Also, Cuomo entered the New York mayoral race as a front-runner. Here’s the latest at the end of Monday.	https://www.nytimes.com/2025/03/03/briefing/trump-tariffs-canada-mexico-ukraine-zelensky-diplomacy.html	Politics
Oil Prices Fall After OPEC Plus Affirms Plan to Raise Production	The Saudi-led cartel said its members would start gradually pumping more oil in April.	https://www.nytimes.com/2025/03/03/business/energy-environment/oil-prices-opec-production.html	Politics
The Best Movies and TV Shows Coming to Netflix in March	New arrivals for U.S. subscribers include a sweeping adaptation of a literary classic and a quirky science-fiction movie starring Millie Bobby Brown.	https://www.nytimes.com/2025/03/03/arts/television/netflix-new-march.html	Politics
‘Picture This’ Review: Five Dates Away From Love	Simone Ashley (“Bridgerton”) stars as Pia, a talented photographer in London navigating business pressures with her wish for independence in this vivid rom-com.	https://www.nytimes.com/2025/03/06/movies/picture-this-review.html	Business
Sweeping Tariffs Threaten to Undo a 30-Year Trade Alliance	President Trump’s stiff tariffs on Mexico and Canada could push those allies into recession. The impact for America could be messy.	https://www.nytimes.com/2025/03/06/us/politics/trump-tariffs-mexico-canada-us.html	Business
E.C.B. Cuts Interest Rates Again, With an Uncertain Path Ahead	Vows by European leaders in increase borrowing to ramp up military spending has reshaped the fiscal picture that the central bank must confront.	https://www.nytimes.com/2025/03/06/business/ecb-interest-rates.html	Business
Who’s Got Trump’s Ear on Tariffs?	Corporate leaders and investors continue to be caught off guard by the president’s trade policy, especially as deal talks heat up.	https://www.nytimes.com/2025/03/06/business/dealbook/trump-lutnick-tariffs-deals.html	Business
Macy’s Signals Rocky Year Ahead as Retailers Reckon With Trade War	The largest department store chain in the United States, like many other retailers, have recently warned that shoppers may be more cautious in the months ahead.	https://www.nytimes.com/2025/03/06/business/macys-retail-tariffs-economy.html	Business
Taiwan’s President Tries to Ease Fears Over U.S. Chip Investment	The Taiwanese chip giant TSMC’s plan to invest $100 billion in the United States has been met with anxiety and criticism in its home country.	https://www.nytimes.com/2025/03/06/world/asia/taiwan-tsmc-chips-arizona.html	Business
Judges vs. Trump	We explore how the judiciary is stopping parts of the president’s agenda.	https://www.nytimes.com/2025/03/06/briefing/supreme-court-donald-trump.html	Business
David Brooks on Why the Democrats Are Losing to Trump	The columnist shares his thoughts on Donald Trump’s second term.	https://www.nytimes.com/2025/03/06/opinion/david-brooks-trump-power.html	Business
Who Paid for Trump’s Transition to Power? The Donors Are Still Unknown.	President Trump has not made good on a promise to disclose who contributed to his transition effort.	https://www.nytimes.com/2025/03/06/us/politics/donald-trump-2024-campaign-transition.html	Business
A Muslim Athlete Needed Modest Sportswear. Now She Sells It to Others.	Seeking balance between religion and comfort while playing basketball, Kiandra Browne realized there was a need for better apparel. Her small business is helping fill it.	https://www.nytimes.com/2025/03/06/style/kiandra-browne-duquesne-hijab-muslim.html	Business
How the Biggest Crypto Heist in History Went Down	The cryptocurrency exchange Bybit lost $1.5 billion to North Korean hackers last month — and it all traced back to an account on a free digital storage service.	https://www.nytimes.com/2025/03/06/technology/bybit-crypto-hack-north-korea.html	Business
‘Mickey 17’ Review: This Job Is Killing Him	In Bong Joon Ho’s latest dystopian romp, Robert Pattinson plays a hapless underdog whose work aboard a spaceship requires him to die, over and over.	https://www.nytimes.com/2025/03/06/movies/mickey-17-review.html	Business
Clearing the Way for Bicyclists, for a Healthier Population and Planet	Jill Warren heads the European Cyclists’ Federation, a Brussels-based nongovernmental organization that advocates cycling to help lower carbon emissions.	https://www.nytimes.com/2025/03/06/health/women-bicycling-europe-climate.html	Business
All She Wanted to Do Was Play. Football, That Is.	To create opportunities for others who shared her goal, Odessa Jenkins started her own professional full-contact league for women players.	https://www.nytimes.com/2025/03/06/business/women-power-football-odessa-jenkins.html	Business
He Gave a Name to What Many Christians Feel	And the feeling isn’t good. Aaron Renn has gained a following by warning that the U.S. is currently a “negative world” for Christianity.	https://www.nytimes.com/2025/03/06/us/aaron-renn-christianity-conservative-negative-world.html	Business
Why Some Schools Are Rethinking ‘College for All’	The idea that every student should aim for a four-year college motivated a bipartisan movement for decades. Now even enthusiastic promoters of the idea are reconsidering it.	https://www.nytimes.com/2025/03/06/us/college-for-all-kipp-international-baccalaureate.html	Business
Merci, a Second Time Around	“We think of ourselves as post-luxury,” says the chief executive of the French boutique’s new lifestyle-shopping outpost.	https://www.nytimes.com/2025/03/06/fashion/merci-retail-paris.html	Business
Sexy vs. Seductive Clothes	A difference with a distinction at Tom Ford. Plus the new Dries Van Noten lacked restraint.	https://www.nytimes.com/2025/03/06/style/tom-ford-haider-ackermann-dries-van-noten.html	Business
7-Eleven Taps American Executive to Help Keep It Out of Canadian Hands	The Japanese owner of the chain also announced a plan to list its U.S. convenience store business as it tries to fend off a Canadian retailer’s $47 billion takeover bid.	https://www.nytimes.com/2025/03/06/business/7-eleven-stephen-dacus.html	Business
Review: Wrestling With Angels and Demons in ‘Sumo’	An Off Broadway play opens a window on the spiritual and physical trials of the ancient Japanese sport.	https://www.nytimes.com/2025/03/05/theater/sumo-review-public-theater.html	Business
Federal Grant Program Opens Door to Elon Musk’s Starlink	Under new rules from President Trump’s Commerce Department, a $42 billion high-speed internet effort will no longer favor fiber-optic cable.	https://www.nytimes.com/2025/03/05/technology/broadband-rules-elon-musk-starlink.html	Business
Attorney General’s Brother Seeks to Lead D.C. Bar Association	Bradley Bondi, brother of Pam Bondi, is running for president of Washington’s bar association, which may consider complaints against political appointees in the Justice Department.	https://www.nytimes.com/2025/03/05/us/politics/pam-bondi-brother.html	Business
Senate Confirms Trump Attorney Todd Blanche as No. 2 Justice Dept. Official	The president’s lead criminal defense attorney takes the key role of running day-to-day operations of federal prosecutors.	https://www.nytimes.com/2025/03/05/us/politics/todd-blanche-trump-deputy-ag-senate-confirmation.html	Business
G.O.P. Representatives and Democratic Mayors Spar Over Sanctuary Cities	At a House hearing, the mayors of Boston, Chicago, Denver and New York City rejected accusations that they were harboring criminals by not aiding deportation efforts.	https://www.nytimes.com/2025/03/05/nyregion/sanctuary-city-hearing-congress.html	Business
Carmakers Were Given a Monthlong Reprieve From Tariffs	Also, meet the man who wants to save the world from bad sound. Here’s the latest at the end of Wednesday.	https://www.nytimes.com/2025/03/05/briefing/trump-carmakers-tariff-supreme-court-ruling-aid.html	Business
Discord in Early Talks With Bankers for Potential I.P.O.	The app has become a mainstay of the video game community and young internet users.	https://www.nytimes.com/2025/03/05/technology/discord-ipo.html	Business
How to Tell That the Chain Saw Is Coming for America	“Shock and awe” didn’t end well in Iraq and it won’t end well in the United States.	https://www.nytimes.com/2025/03/05/opinion/trump-musk-ukraine-iraq.html	Business
