Title	Snippet	URL	Category
Chicago’s Mayor Pushes Back as Republicans Attack Immigration Policies	Mayor Brandon Johnson argued that Chicago’s policies made the city safer and allowed residents to help the police solve crimes without fear of deportation.	https://www.nytimes.com/2025/03/05/us/brandon-johnson-chicago-mayor-sanctuary-city-hearing.html	Business
Former Nassau County Detective Who Moonlighted for Mafia Is Convicted	Hector Rosario had hoped to earn big from his work for the Bonanno crime family. He wound up with about $8,000 and an indictment.	https://www.nytimes.com/2025/03/05/nyregion/nassau-county-detective-mob-trial-convicted.html	Business
South Africa Prepares Trade Deal Meant to Ease Tensions With Trump	Lawmakers were warned that the United States is planning more punitive actions against the country. Officials hope a new trade deal will help repair the icy relations.	https://www.nytimes.com/2025/03/05/world/africa/south-africa-trump-trade.html	Business
Trump Says U.S. Banks Can’t Do Business in Canada. It’s Not That Simple.	President Trump has complained that American banks are restricted from operating in Canada. They can, but are hamstrung.	https://www.nytimes.com/2025/03/05/business/trump-canada-us-banks.html	Business
Justice Dept. Indicts 12 Chinese in Hacking Plot Against U.S. Targets	The suspects were charged as part of what U.S. officials called a “hackers for hire” system whose primary customer was the Chinese government.	https://www.nytimes.com/2025/03/05/us/politics/china-hackers-justice-dept.html	Business
Florida Seeks Drug Prescription Data With Names of Patients and Doctors	The state’s insurance regulator has demanded detailed information about patients and their medications, raising privacy concerns.	https://www.nytimes.com/2025/03/05/health/florida-prescriptions-patient-privacy-data.html	Business
Most Contaminated U.S. Nuclear Site Is Set to Be the Largest Solar Farm	Plans to transform Hanford, which was integral to the nation’s nuclear arsenal after World War II, had just begun inching forward when President Trump started his second term.	https://www.nytimes.com/2025/03/05/business/hanford-nuclear-site-solar-farm.html	Business
Trump to Pause Auto Tariffs for One Month as Other Levies Continue	The president said he would pause a 25 percent tariff on cars coming from Canada and Mexico under a trade pact for one month, while other levies stay in place.	https://www.nytimes.com/2025/03/05/us/politics/trump-lutnick-tariffs-reduction-canada-mexico.html	Business
Should I Tell My Son That His Best Friend Is Stealing From Him?	The magazine’s Ethicist columnist on the importance of disclosure and trust among loved ones.	https://www.nytimes.com/2025/03/05/magazine/son-friend-stealing-ethics.html	Business
How Do You Preserve a Vanishing Music Scene?	Five recent books collect photographs, memories and ephemera from the hardcore band Agnostic Front, the mysterious dance artist Aphex Twin, the rap collective Odd Future and more.	https://www.nytimes.com/2025/03/05/arts/music/music-books-aphex-twin-chief-keef.html	Business
The Secret Campaign in China to Save a Woman Chained by the Neck	The accidental discovery of the woman led to a video that went viral, spurring public outrage. The Communist Party quashed the discussion, but the anger never went away.	https://www.nytimes.com/interactive/2025/03/05/world/asia/xuzhou-china-chained-woman-incident-activists.html	Business
Supreme Court Rejects Trump’s Bid to Freeze Foreign Aid	The move came after Chief Justice Roberts temporarily paused a trial judge’s order requiring the administration to release more than $1.5 billion.	https://www.nytimes.com/2025/03/05/us/politics/foreign-aid-supreme-court-trump.html	Business
Trump Administration Pauses Intelligence Sharing With Ukraine	Officials say the halt in assistance is a warning to the Ukrainians of the consequences of not cooperating with the president.	https://www.nytimes.com/2025/03/05/us/politics/cia-director-ukraine-intelligence.html	Business
Gaming Out Trump’s Next Tariff Moves	In his address to Congress, the president made clear that his new trade levies were here to stay, acknowledging it might create “a little disturbance.” Analysts forecast what that might look like.	https://www.nytimes.com/2025/03/05/business/dealbook/trump-tariff-next-moves.html	Business
Tesla Sales Slump in Europe as Anger Toward Elon Musk Grows	February numbers show the U.S. electric-car maker is struggling to attract buyers in the region. Mr. Musk’s politics aren’t helping.	https://www.nytimes.com/2025/03/05/business/tesla-germany-sales-elon-musk.html	Business
Digg Returns, With Social Media in Tumult	Two decades after creating Digg, a community-focused social message board, Kevin Rose is reviving the site and teaming up with a founder of Reddit.	https://www.nytimes.com/2025/03/05/technology/digg-alexis-ohanian-kevin-rose.html	Business
As U.S. Tariffs Become Reality, Canadians Prepare for Economic Pain	An expert in the automotive industry says factories may shut down in days as costs skyrocket and President Trump disrupts decades of economic integration with steep tariffs.	https://www.nytimes.com/2025/03/05/world/canada/canada-trump-tariff-shock.html	Business
How Soon Could Ukraine’s Forces ‘Start to Buckle’ Without U.S. Weapons?	It could be as little as four months, say analysts, as Europe scrambles to plug the hole in support left by President Trump’s suspension of military aid.	https://www.nytimes.com/2025/03/05/world/americas/ukraine-us-weapons-suspension.html	Business
‘We Have Given Him Everything’: Trump’s Tariffs Stun Mexico	President Claudia Sheinbaum’s government made major concessions — and delivered results — to avert President Trump’s 25 percent tariffs. He imposed them anyway.	https://www.nytimes.com/2025/03/05/world/americas/trump-mexico-tariffs-sheinbaum.html	Business
What Some Reluctant Trump Voters Thought of His Speech	For many reluctant Trump voters, there was a mixture of confidence, anxiety, hope and frustration — along with some anger directed at congressional Democrats.	https://www.nytimes.com/2025/03/05/us/trump-address-us-reaction.html	Business
Fashion Has Given Up on Being Woke, and That’s OK	Fashion spent a decade trying to be socially conscious but now is going all in on opulence and catering to the powerful.	https://www.nytimes.com/2025/03/05/opinion/fashion-has-given-up-on-being-woke-and-thats-ok.html	Business
Do You Need Another Measles Shot?	New York officials have released a health advisory about the disease as cases surge in Texas. They advise checking your vaccination record.	https://www.nytimes.com/2025/03/05/nyregion/measles-vaccination-new-york.html	Business
5 Minutes That Will Make You Love Chicago Jazz	Explore the Windy City through tracks by Ramsey Lewis, Ahmad Jamal, Lester Bowie and the contemporary artists at the forefront of today’s sound.	https://www.nytimes.com/2025/03/05/arts/music/chicago-jazz-music.html	Business
How a Shocking Act of Literary Vandalism Helped a Family Start Again	A cache of family documents led a journalist to discover the source of the wealth that allowed his family to remake life in Australia after surviving World War II in Europe.	https://www.nytimes.com/2025/03/05/books/michael-visontay-noble-fragments.html	Business
Why Is Hollywood Obsessed With Architects? ‘The Brutalist’ Gives Us a Hint.	The trope of the embattled auteur exerting their will is too tempting for filmmakers to ignore.	https://www.nytimes.com/2025/03/05/magazine/architects-the-brutalist-megalopolis.html	Business
Concert Ticket Prices Are Soaring, and Busting Gen Z’s Budgets	How can 20-somethings afford the high cost of seeing their favorite artists’ live shows? Some save; some go into debt.	https://www.nytimes.com/2025/03/05/business/gen-z-concert-tickets-taylor-swift-beyonce.html	Business
Do You Have a ‘Third Place’?	Besides home and school, where do you go to gather with others on a regular basis?	https://www.nytimes.com/2025/03/05/learning/do-you-have-a-third-place.html	Business
The Wizard of Vinyl Is in Kansas	Chad Kassem is on a mission — saving listeners “from bad sound” — at the rural factory where he pores over LPs from some of music’s most important artists.	https://www.nytimes.com/2025/03/05/arts/music/vinyl-albums-chad-kassem-acoustic-sounds.html	Business
When Older Renters Become First-Time Buyers	As some people age, they begin to think more seriously about building equity in their homes and having something to leave to their heirs.	https://www.nytimes.com/2025/03/05/realestate/older-renters-buyers-market.html	Business
In ‘Deli Boys,’ Two Actors Find Dream Roles Playing No One’s Hero	Saagar Shaikh and Asif Ali will do “unspeakable things” in a Hulu comedy that centers on South Asians, drugs, violence — and the minimart.	https://www.nytimes.com/2025/03/05/arts/television/deli-boys-hulu-pakistani-american.html	Business
A Rocky Patch for Lab-Grown Diamonds	Despite interest from consumers and some watch and jewelry brands, oversupply and industry consolidation have slashed prices.	https://www.nytimes.com/2025/03/05/fashion/lab-grown-diamonds-watches-breitling-oris.html	Business
Why Is This the Most Controversial Restaurant in London?	The cook at the London restaurant the Yellow Bittern serves up controversy alongside hearty stews. And it all boils down to class.	https://www.nytimes.com/2025/03/05/dining/yellow-bittern-london-restaurant.html	Business
French Cinema Leads the Way to a Revival of In-Person Moviegoing	The French movie industry has been celebrating statistics that show an increase in movie attendance.	https://www.nytimes.com/2025/03/05/world/europe/france-cinema-attendance-covid.html	Business
Watch Bands Inspired by Old Parachute Webbing	Erika’s Originals makes the MN Strap at an atelier in Spain, filling a demand for bands that are based on some military models.	https://www.nytimes.com/2025/03/05/fashion/watches-parachute-web-straps.html	Business
Paris Gets Its Own Met Gala	Doechii, Michelle Yeoh, Dev Patel and more stars mingled with fashion’s celebrities at the first fashion-fabulous Grand Dîner du Louvre.	https://www.nytimes.com/2025/03/05/style/paris-met-gala-louvre-grand-diner.html	Business
Trump Celebrates His Disruption but Slides Over Its Costs	The president’s speech to Congress covered tariffs, Ukraine and cuts to the federal work force but did little to address the perils that accompany the abrupt shifts he has engineered.	https://www.nytimes.com/2025/03/05/us/politics/trump-speech-ukraine-tariffs.html	Business
Trump Says Japan and South Korea Want to Invest in $44 Billion Gas Project	Investors have balked at the project, stalling its progress. But under the threat of tariffs, Japan and South Korea have started exploring ways to invest in Alaska L.N.G.	https://www.nytimes.com/2025/03/05/us/politics/trump-lng-japan-south-korea.html	Business
‘It Was 90-Plus Minutes of Bad Moments’: 9 Opinion Writers on Trump’s Address to Congress	What Times Opinion columnists and writers thought of the president’s speech to Congress.	https://www.nytimes.com/2025/03/05/opinion/trump-congress-speech.html	Business
Warning That Trump Will ‘Make You Pay,’ Slotkin Gives Democratic Response	The Michigan Democrat, a first-term senator, opted for a simple and brief response to President Trump’s speech, arguing that his agenda would be costly for Americans and leave them less safe.	https://www.nytimes.com/2025/03/05/us/politics/elissa-slotkin-trump-speech-response.html	Business
America the Evil Mastermind? Not So Fast, Russians Are Told.	As President Trump begins to side with Russia, the Kremlin propaganda machine has changed its tune.	https://www.nytimes.com/2025/03/05/world/europe/russia-us-ukraine-trump-putin.html	Business
Full Transcript of President Trump’s Speech to Congress	In a speech to Congress in his first weeks in office, the president laid out his vision to remake U.S. policy on the military, trade, immigration and foreign aid.	https://www.nytimes.com/2025/03/04/us/politics/transcript-trump-speech-congress.html	Business
Trump Officials Mark Hundreds of Federal Properties for Potential Sale	Eliminating “underutilized” federal office space has become a fixation for Elon Musk and his Department of Government Efficiency operation.	https://www.nytimes.com/2025/03/04/us/politics/trump-federal-property-buildings-sale.html	Business
Small Contribution	Rebecca Goldstein gives us a witty jump scare.	https://www.nytimes.com/2025/03/04/crosswords/daily-puzzle-2025-03-05.html	Business
Canadians and Wayne Gretzky: Anatomy of a Relationship on Thin Ice	In tense political times, can “The Great One” be both a Trump supporter and a beloved hero in Canada? Some want him to pick a side. (Preferably the one to the north.)	https://www.nytimes.com/2025/03/04/us/gretzky-trump-canada-hockey.html	Business
Corrections: March 5, 2025	Corrections that appeared in print on Wednesday, March 5, 2025.	https://www.nytimes.com/2025/03/04/pageoneplus/corrections-march-5-2025.html	Business
Xi’s Message: The Economy Is Strong, and China Won’t Back Down	As Chinese leaders meet in Beijing, they are striking a confident posture despite serious challenges to the economy and growing pressure from the United States.	https://www.nytimes.com/2025/03/04/world/asia/china-economy-congress.html	Business
‘Final Mission’ for Education Dept. Begins Now, McMahon Says	President Trump has said he wants to do away with the department, and in her first hours as education secretary, Linda McMahon indicated she would follow his lead.	https://www.nytimes.com/2025/03/04/us/politics/mcmahon-education-final-mission.html	Business
What to Expect From Trump’s Address to Congress	Also, Canada and China retaliated against U.S. tariffs. Here’s the latest at the end of Tuesday.	https://www.nytimes.com/2025/03/04/briefing/trump-speech-congress-tariff-canada-china-mexico.html	Business
American Farmers Brace for Harm From Retaliatory Tariffs	Trade wars during President Trump’s first term slashed billions of dollars in U.S. agricultural exports. Farmers and trade groups expect an even bigger hit this time.	https://www.nytimes.com/2025/03/04/business/retaliatory-tariffs-farmers.html	Business
Climate Groups Were Counting on $20 Billion. Trump Won’t Let Them Access It.	The Justice Department and F.B.I. are investigating $20 billion in climate funds, despite a top prosecutor’s decision that there was not sufficient evidence of wrongdoing.	https://www.nytimes.com/2025/03/04/climate/green-bank-climate-trump-freeze.html	Business
Trump’s Trade War Could Be His Biggest Economic Gamble	President Trump has offered a mix of reasons for upending global trade relations, baffling and angering America’s biggest trading partners.	https://www.nytimes.com/2025/03/04/us/politics/trump-trade-war-economy.html	Business
Canada and China Retaliate Against U.S. Tariffs, Which Trudeau Derides as ‘Dumb’	Prime Minister Justin Trudeau of Canada warned that the Trump administration’s tariffs were leading to a trade war. Mexico’s leader vowed to impose countermeasures on Sunday.	https://www.nytimes.com/2025/03/04/world/americas/tariffs-mexico-canada-china-trump.html	Business
The (Fatuous) Case for Betraying Ukraine	The organizing principle of Putin’s reign has been the restoration of Soviet power at the expense of people power.	https://www.nytimes.com/2025/03/04/opinion/trump-zelensky-ukraine.html	Business
The Big Government Contracts DOGE Hasn’t Touched	By not targeting major sources of spending like defense, the group has had a minimal impact on the federal budget so far but a big effect on many small companies.	https://www.nytimes.com/interactive/2025/03/04/upshot/doge-musk-contracts-cuts.html	Business
It’s Hard to Believe How Cool These Dresses Are	Illuminated, kaleidoscopic dresses at Anrealage made the case that we’re all walking billboards.	https://www.nytimes.com/2025/03/04/style/anrealage-light-up-dresses-paris-fashion-week.html	Business
Peter Sichel, Wine Merchant With a Cloak-and-Dagger Past, Dies at 102	He played a crucial role in the early days of the C.I.A., as a station chief in Cold War Berlin and Hong Kong, before shifting gears to popularize Blue Nun wine.	https://www.nytimes.com/2025/03/04/dining/drinks/peter-sichel-dead.html	Business
‘Dabba Cartel’ Is a Go-Go-Go Drama With Depth	This Indian Netflix series isn’t the most original thing ever, but it comes loaded with brains, humor and electric performances.	https://www.nytimes.com/2025/03/04/arts/television/dabba-cartel-netflix.html	Business
5 Takeaways From ‘With Love, Meghan’	The new streaming series from the Duchess of Sussex has arrived. It shows her cooking, creating and harvesting, and feels like a billboard for things to come.	https://www.nytimes.com/2025/03/04/style/meghan-markle-netflix-takeaways.html	Business
N.Y.C. Council Speaker Attacks Trump in Potential Preview of Mayoral Bid	In her final State of the City address, Speaker Adrienne Adams, who is considering a run for mayor, proposed ideas that she said could be “scaled for greater impact.”	https://www.nytimes.com/2025/03/04/nyregion/adrienne-adams-mayor-state-of-city.html	Business
The Wi-Fi Code Is ‘TrumpLovesYou,’ but the Cafe’s Clients Aren’t Feeling It	At a pizza and coffee joint in Kyiv named for the U.S. president, patrons are having second thoughts about its moniker after President Trump suspended military aid to Ukraine.	https://www.nytimes.com/2025/03/04/world/europe/trump-ukraine-pizza-cafe.html	Business
After Trump Applies Pressure, Wall Street Giant Moves Into Panama	An investor group led by BlackRock will acquire two ports near the Panama Canal that are owned by CK Hutchison and have been the subject of a dispute between President Trump and Panama.	https://www.nytimes.com/2025/03/04/business/blackrock-panama-canal-ports-hutchison.html	Business
Chinese Architect Liu Jiakun Wins Pritzker Prize	Liu, known for understated structures that respond to their surroundings, has been awarded the profession’s highest honor.	https://www.nytimes.com/2025/03/04/arts/design/chinese-architect-liu-jiakun-pritzker-prize.html	Business
After a Decade Away, ‘Mamma Mia!’ Is Returning to Broadway This Summer	The musical’s original run was the ninth-longest in Broadway history; a six-month return engagement will start in August.	https://www.nytimes.com/2025/03/04/theater/mamma-mia-broadway-abba.html	Business
Trump’s Tariffs Plunge Global Markets Into a Sea of Red	Global leaders are retaliating and investors have sold off stocks in Asia and Europe.	https://www.nytimes.com/2025/03/04/business/dealbook/trump-tariffs-markets-business.html	Business
Trade War Sends a Shiver Through Global Markets	Wall Street has wiped out the gains made since President Trump’s election victory, as investors’ hopes of business-friendly policies have given way to fears over tariffs.	https://www.nytimes.com/2025/03/04/business/stock-market-today-trump-tariffs.html	Business
America’s Flex	We cover President Trump’s new tariffs.	https://www.nytimes.com/2025/03/04/briefing/donald-trump-tariffs-canada-mexico-china.html	Business
In One Swing District, Guarded Optimism After Trump’s First Six Weeks	With President Trump set to address a joint session of Congress on Tuesday, many voters in Arizona’s divided First Congressional District remain hopeful for his new term, even amid partisan rancor.	https://www.nytimes.com/2025/03/04/us/politics/trump-arizona-swing-voters.html	Business
Commerce Secretary’s Comments Raise Fears of Interference in Federal Data	Howard Lutnick, the commerce secretary, suggested government spending should be excluded from data about U.S. economic output.	https://www.nytimes.com/2025/03/04/business/economy/gdp-data-lutnick-commerce-secretary.html	Business
‘Trump Is the Real Thing’	Vengeance is his.	https://www.nytimes.com/2025/03/04/opinion/trump-imperial-presidency.html	Business
Mardi Gras 2025: Joy and Jitters for New Orleans	There was never any question that Mardi Gras would go forward after the New Year’s Day terror attack in New Orleans. But some revelers felt at least a hint of trepidation.	https://www.nytimes.com/2025/03/04/us/politics/mardi-gras-new-orleans.html	Business
In Face of Trump’s Tariffs, Mexico Embraces Its President and Nationalism	Before the tariffs went into effect, approval ratings for President Claudia Sheinbaum rose and companies began marketing “Made in Mexico” products.	https://www.nytimes.com/2025/03/04/world/americas/mexico-tariffs-nationalism.html	Business
Memo to the Business Elite: It’s Time to Stand Up	Most executives are not protectionist, isolationist or xenophobic. Nor do they want to be complicit.	https://www.nytimes.com/2025/03/04/opinion/business-ceo-trump-tariffs.html	Business
How Trump Can Turn the Ukraine Mineral Deal Into Real Security	Trump needs to back up any minerals agreement with substantive investment and diplomacy.	https://www.nytimes.com/2025/03/04/opinion/ukraine-minerals-deal.html	Business
How Covid Remade America	It feels as if the pandemic is behind us. But we’re living in the world it made.	https://www.nytimes.com/interactive/2025/03/04/opinion/covid-impact-five-years-later.html	Business
Why Putin Can’t Wait to Have McDonald’s Back in Moscow	As the Trump administration pushes for renewed business ties with Russia, a new book looks back at the companies that helped prop up illiberalism in the country.	https://www.nytimes.com/2025/03/04/books/review/zero-sum-charles-hecker.html	Business
TEFAF Turns From the Classic to the Contemporary	The European Fine Art Fair is embracing the work by newer, younger and more modern artists.	https://www.nytimes.com/2025/03/04/arts/design/marianne-boesky-tefaf.html	Business
After the Apocalypse, Will We Decamp to a Suburb or a High-Rise?	“Paradise” and “Silo” have opposing takes on the future of urban organization, echoing the debate over America’s housing shortage today.	https://www.nytimes.com/2025/03/04/business/economy/silo-paradise-housing-shortage.html	Business
Showing Courage in Ukraine With Handfuls of Clay	Founded seven years ago in Kyiv, GORN Ceramics has become an object lesson in survival.	https://www.nytimes.com/2025/03/04/arts/ukraine-statues-design.html	Business
The Shop That Changed What We Wear	Agnès b. was fresh, cool and totally Parisian, and it established the model for a raft of accessibly chic Euro labels to come.	https://www.nytimes.com/2025/03/04/style/agnes-b-agnes-trouble-shopping-paris.html	Business
Dr. Pimple Popper Knows You Can’t Look Away	Dr. Sandra Lee has built a new kind of dermatologic empire by sharing gnarly extractions and cyst removals with the world online.	https://www.nytimes.com/2025/03/04/well/dr-pimple-popper-profile-sandra-lee.html	Business
China Targets San Diego Biotech Firm in Broadening Blacklist	In a sign it is willing to go further in responding to President Trump’s tariffs, Beijing blocked more American companies from importing goods into China.	https://www.nytimes.com/2025/03/04/us/illumina-china-unreliable-entities-list.html	Business
Late Night Recaps Zelensky’s Casual Friday at the White House	“I don’t see you asking Elon Musk if he owns a suit,” Seth Meyers said of the reporter who questioned Ukraine’s president about his attire.	https://www.nytimes.com/2025/03/04/arts/television/late-night-zelensky-suit-trump.html	Business
A Plan for Legal Weed Shops Failed. New York Wants Its Money Back.	The state contributed $50 million to a failed plan to build 150 dispensaries. Gov. Kathy Hochul’s plan to recover the money has stirred concern.	https://www.nytimes.com/2025/03/04/nyregion/cannabis-marijuana-hochul.html	Business
China Retaliates Against Trump Tariffs as Superpower Trade War Escalates	Beijing imposed broad tariffs on imports of American food and said 15 U.S. companies could no longer buy from China without special permission.	https://www.nytimes.com/2025/03/04/business/trump-tariffs-china-reacts.html	Business
Trump’s Tariffs on Canada, Mexico and China Snap Into Effect	President Trump imposed hefty tariffs on the United States’ largest trading partners on Tuesday, roiling global relations and sending shock waves through industries that depend on trade.	https://www.nytimes.com/2025/03/04/business/economy/trump-tariffs-canada-mexico-china.html	Business
Corrections: March 4, 2025	Corrections that appeared in print on Tuesday, March 4, 2025.	https://www.nytimes.com/2025/03/03/pageoneplus/corrections-march-4-2025.html	Business
Carl Dean, Dolly Parton’s Husband of Nearly 60 Years, Dies at 82	Mr. Dean, who inspired songs including “Jolene” and “From Here to the Moon and Back,” was known to shy away from the spotlight as his wife rose to fame.	https://www.nytimes.com/2025/03/03/us/carl-dean-dead.html	Business
How Each Senator Voted to Confirm Linda McMahon as Education Secretary	The Senate confirmed Ms. McMahon to lead the Education Department by a party-line vote of 51 to 45.	https://www.nytimes.com/interactive/2025/03/03/us/politics/mcmahon-senate-confirmation-vote.html	Business
Senate Confirms Linda McMahon as Education Secretary	Ms. McMahon, who has little experience in private or public schools, will take over a department that President Trump has already begun to dismantle.	https://www.nytimes.com/2025/03/03/us/politics/linda-mcmahon-education-secretary.html	Business
